{
  "contract_version": "0.1",
  "kind": "board",
  "generated_at": "2026-09-22T20:00:00.000Z",
  "positions": {
    "C": [
      {
        "tier": 1,
        "players": [
          {
            "id": "8478402",
            "name": "McDavid",
            "club": "EDM",
            "pos": "C",
            "rank": 1,
            "age": 29.7,
            "ppg": 1.68,
            "flags": [
              "3.7 shots/gm"
            ],
            "note": "1.68 points a game last season, age 29; 3.7 shots/gm.",
            "taken": true
          },
          {
            "id": "8477492",
            "name": "MacKinnon",
            "club": "COL",
            "pos": "C",
            "rank": 3,
            "age": 31.1,
            "ppg": 1.59,
            "flags": [
              "4.4 shots/gm"
            ],
            "note": "1.59 points a game last season, age 31; 4.4 shots/gm.",
            "taken": true
          },
          {
            "id": "8484801",
            "name": "Celebrini",
            "club": "SJS",
            "pos": "C",
            "rank": 4,
            "age": 20.3,
            "ppg": 1.4,
            "flags": [
              "3.5 shots/gm"
            ],
            "note": "1.4 points a game last season, age 20; 3.5 shots/gm.",
            "taken": false
          },
          {
            "id": "8476460",
            "name": "Scheifele",
            "club": "WPG",
            "pos": "C",
            "rank": 5,
            "age": 33.5,
            "ppg": 1.26,
            "flags": [
              "age 33.5 on 21.5 min \u2014 usage may not hold"
            ],
            "note": "1.26 points a game last season, age 33; age 33.5 on 21.5 min \u2014 usage may not hold.",
            "taken": false
          },
          {
            "id": "8480018",
            "name": "Suzuki",
            "club": "MTL",
            "pos": "C",
            "rank": 6,
            "age": 27.1,
            "ppg": 1.23,
            "flags": [],
            "note": "1.23 points a game last season, age 27.",
            "taken": false
          },
          {
            "id": "8480039",
            "name": "Necas",
            "club": "COL",
            "pos": "C",
            "rank": 8,
            "age": 27.7,
            "ppg": 1.28,
            "flags": [],
            "note": "1.28 points a game last season, age 27.",
            "taken": false
          }
        ]
      },
      {
        "tier": 2,
        "players": [
          {
            "id": "8477934",
            "name": "Draisaitl",
            "club": "EDM",
            "pos": "C",
            "rank": 9,
            "age": 30.9,
            "ppg": 1.49,
            "flags": [],
            "note": "1.49 points a game last season, age 30.",
            "taken": false
          },
          {
            "id": "8478403",
            "name": "Eichel",
            "club": "VGK",
            "pos": "C",
            "rank": 13,
            "age": 29.9,
            "ppg": 1.22,
            "flags": [
              "3.5 shots/gm"
            ],
            "note": "1.22 points a game last season, age 29; 3.5 shots/gm.",
            "taken": false
          },
          {
            "id": "8477404",
            "name": "Guentzel",
            "club": "TBL",
            "pos": "C",
            "rank": 16,
            "age": 32,
            "ppg": 1.09,
            "flags": [],
            "note": "1.09 points a game last season, age 32.",
            "taken": false
          },
          {
            "id": "8482740",
            "name": "Johnston",
            "club": "DAL",
            "pos": "C",
            "rank": 18,
            "age": 23.4,
            "ppg": 1.05,
            "flags": [],
            "note": "1.05 points a game last season, age 23.",
            "taken": false
          },
          {
            "id": "8482116",
            "name": "St\u00fctzle",
            "club": "OTT",
            "pos": "C",
            "rank": 21,
            "age": 24.7,
            "ppg": 1.04,
            "flags": [],
            "note": "1.04 points a game last season, age 24.",
            "taken": false
          },
          {
            "id": "8479420",
            "name": "Thompson",
            "club": "BUF",
            "pos": "C",
            "rank": 22,
            "age": 28.9,
            "ppg": 1,
            "flags": [
              "3.4 shots/gm"
            ],
            "note": "1 points a game last season, age 28; 3.4 shots/gm.",
            "taken": false
          }
        ]
      },
      {
        "tier": 3,
        "players": [
          {
            "id": "8478427",
            "name": "Aho",
            "club": "CAR",
            "pos": "C",
            "rank": 24,
            "age": 29.2,
            "ppg": 1.01,
            "flags": [],
            "note": "1.01 points a game last season, age 29.",
            "taken": false
          },
          {
            "id": "8476459",
            "name": "Zibanejad",
            "club": "NYR",
            "pos": "C",
            "rank": 29,
            "age": 33.4,
            "ppg": 0.96,
            "flags": [
              "age 33.4 on 20.9 min \u2014 usage may not hold"
            ],
            "note": "0.96 points a game last season, age 33; age 33.4 on 20.9 min \u2014 usage may not hold.",
            "taken": false
          },
          {
            "id": "8481559",
            "name": "Hughes",
            "club": "NJD",
            "pos": "C",
            "rank": 31,
            "age": 25.4,
            "ppg": 1.26,
            "flags": [
              "3.7 shots/gm"
            ],
            "note": "1.26 points a game last season, age 25; 3.7 shots/gm.",
            "taken": false
          },
          {
            "id": "8484144",
            "name": "Bedard",
            "club": "CHI",
            "pos": "C",
            "rank": 33,
            "age": 21.2,
            "ppg": 1.09,
            "flags": [
              "3.3 shots/gm"
            ],
            "note": "1.09 points a game last season, age 21; 3.3 shots/gm.",
            "taken": false
          },
          {
            "id": "8475158",
            "name": "O'Reilly",
            "club": "NSH",
            "pos": "C",
            "rank": 36,
            "age": 35.6,
            "ppg": 0.91,
            "flags": [
              "age 35.6 on 20.4 min \u2014 usage may not hold"
            ],
            "note": "0.91 points a game last season, age 35; age 35.6 on 20.4 min \u2014 usage may not hold.",
            "taken": false
          },
          {
            "id": "8471675",
            "name": "Crosby",
            "club": "PIT",
            "pos": "C",
            "rank": 37,
            "age": 39.1,
            "ppg": 1.09,
            "flags": [
              "age 39.1 on 19.2 min \u2014 usage may not hold"
            ],
            "note": "1.09 points a game last season, age 39; age 39.1 on 19.2 min \u2014 usage may not hold.",
            "taken": false
          }
        ]
      },
      {
        "tier": 4,
        "players": [
          {
            "id": "8477951",
            "name": "Schmaltz",
            "club": "UTA",
            "pos": "C",
            "rank": 39,
            "age": 30.6,
            "ppg": 0.9,
            "flags": [],
            "note": "0.9 points a game last season, age 30.",
            "taken": false
          },
          {
            "id": "8478445",
            "name": "Barzal",
            "club": "NYI",
            "pos": "C",
            "rank": 44,
            "age": 29.3,
            "ppg": 0.89,
            "flags": [],
            "note": "0.89 points a game last season, age 29.",
            "taken": false
          },
          {
            "id": "8475166",
            "name": "Tavares",
            "club": "TOR",
            "pos": "C",
            "rank": 48,
            "age": 36,
            "ppg": 0.87,
            "flags": [],
            "note": "0.87 points a game last season, age 36.",
            "taken": false
          },
          {
            "id": "8480014",
            "name": "Vilardi",
            "club": "WPG",
            "pos": "C",
            "rank": 51,
            "age": 27.1,
            "ppg": 0.84,
            "flags": [],
            "note": "0.84 points a game last season, age 27.",
            "taken": false
          },
          {
            "id": "8479987",
            "name": "Geekie",
            "club": "BOS",
            "pos": "C",
            "rank": 52,
            "age": 28.2,
            "ppg": 0.84,
            "flags": [],
            "note": "0.84 points a game last season, age 28.",
            "taken": false
          },
          {
            "id": "8484153",
            "name": "Carlsson",
            "club": "ANA",
            "pos": "C",
            "rank": 54,
            "age": 21.7,
            "ppg": 0.96,
            "flags": [],
            "note": "0.96 points a game last season, age 21.",
            "taken": false
          }
        ]
      }
    ],
    "LW": [
      {
        "tier": 1,
        "players": [
          {
            "id": "8480027",
            "name": "Robertson",
            "club": "DAL",
            "pos": "LW",
            "rank": 10,
            "age": 27.2,
            "ppg": 1.17,
            "flags": [
              "3.6 shots/gm"
            ],
            "note": "1.17 points a game last season, age 27; 3.6 shots/gm.",
            "taken": false
          },
          {
            "id": "8478398",
            "name": "Connor",
            "club": "WPG",
            "pos": "LW",
            "rank": 12,
            "age": 29.8,
            "ppg": 1.12,
            "flags": [
              "3.3 shots/gm"
            ],
            "note": "1.12 points a game last season, age 29; 3.3 shots/gm.",
            "taken": false
          },
          {
            "id": "8478864",
            "name": "Kaprizov",
            "club": "MIN",